{
  "schema_version": "1.0",
  "package_id": "PKG-verification-hardening",
  "created_at": "2026-03-22T00:00:00.000Z",
  "updated_at": "2026-03-22T00:00:00.000Z",
  "title": "Verification Hardening",
  "summary": "Bundle for proof-oriented execution on high-risk changes.",
  "status": "admitted",
  "category": "verification",
  "tags": [
    "verification",
    "replay",
    "metadata-first"
  ],
  "skill_ids": [
    "SK-000001",
    "SK-000002"
  ],
  "activation_policy": {
    "metadata_first": true,
    "max_skills": 3,
    "load_full_skill_only_on_match": true
  },
  "published_agent_skill_path": ".agents/skills/verification-hardening/SKILL.md"
}
