{
  "schema_version": "1.0",
  "package_id": "PKG-verification-hardening",
  "created_at": "2026-03-23T10:03:22.103Z",
  "updated_at": "2026-03-23T10:03:22.104Z",
  "title": "Verification Hardening",
  "summary": "Bundle for done-means-verified discipline, regression checks, and contract-level proof.",
  "status": "admitted",
  "category": "verification",
  "tags": [
    "contract",
    "failure-genome",
    "generated",
    "quality",
    "regression",
    "replay",
    "schema",
    "skillgraph",
    "testing",
    "verification"
  ],
  "skill_ids": [
    "SK-000001"
  ],
  "activation_policy": {
    "metadata_first": true,
    "max_skills": 1,
    "load_full_skill_only_on_match": true
  },
  "published_agent_skill_path": ".agents/skills/verification-hardening/SKILL.md"
}
