{
  "schema_version": "1.0",
  "package_id": "PKG-anti-fallback-and-contracts",
  "created_at": "2026-03-23T10:03:22.104Z",
  "updated_at": "2026-03-23T10:03:22.104Z",
  "title": "Anti-Fallback and Contracts",
  "summary": "Bundle for eliminating silent fallbacks and protecting write-read, schema, and verification contracts.",
  "status": "admitted",
  "category": "quality",
  "tags": [
    "contract",
    "failure-genome",
    "fallback",
    "generated",
    "quality",
    "replay",
    "schema",
    "skillgraph",
    "testing",
    "verification"
  ],
  "skill_ids": [
    "SK-000001"
  ],
  "activation_policy": {
    "metadata_first": true,
    "max_skills": 1,
    "load_full_skill_only_on_match": true
  },
  "published_agent_skill_path": ".agents/skills/anti-fallback-and-contracts/SKILL.md"
}
